in uniform , with flags , are gathered outdoors for a ceremony .,5
actor dressed as a pirate performs in an outdoor park .,5
two young women are laughing outdoors by a tree trunk .,5
woman stands outdoors in front of the sun .,5
women are filling out forms at a stand outdoors .,0
dressed Asian women are passing by a doorway in the street .,5
people are playing basketball outdoors .,5
young people drink beer at an outdoor party .,0
in a colorful , outdoor market with fruits , vegetables and flowers .,6
people shopping at an outdoors market .,2
are playing a game of ball outdoors .,5
five people are seated on steps outdoors .,5
people play outdoors .,5
men from two Japanese-sponsored teams play a game of indoor field hockey .,2
man and a woman walk their small dogs at an outdoor event .,5
an outdoor dog show , a very small dog jumps on an older man .,2
dog sits with a woman in an outdoor cafe .,5
woman and her dog sitting at an outdoor cafe table,5
man and a woman wearing masks embrace at an outdoor festival .,0
man and woman dressed up dance together outdoors .,5
gather together outdoors .,5
actors wait inside the doors .,0
children with animal face pain at outdoor event .,5
person doing the backstroke in an outdoor pool .,0
doing a skateboard trick on an outdoor park porch .,0
person is picking up a yellow tent by his or herself in the great outdoors .,6
man in a straw hat and overalls is with a friend outdoors .,2
people in uniform are outdoors and are observing a scene which is out of the picture .,0
sits with orange and black tights at an outdoor performance .,0
dogs wrestle outdoors .,5
woman dressed in winter wear walks outdoors .,2
older people sit at an outdoor cafe table .,5
of people standing and sitting outdoors .,5
making drinks outdoors in a snowy landscape .,5
group of adults and children play with a parachute outdoors .,0
long haired drummer plays music outdoors .,5
man with long hair and tattoos plays a drum outdoors .,5
drummer beats the drums at an outdoor concert .,0
teenage boy is riding a skateboard on the stone handrail of a flight of outdoor steps .,5
man jumps of the handrail of an outdoor staircase .,5
man and a woman sit back to back on a bench in front of a building with a colorful painted door .,6
boy getting soaked playing an outdoor water game .,5
young man skateboards around the empty outdoor sports arena .,5
woman plays a violin outdoors .,5
woman stand near a door .,5
person sits at a doorstep and reads a book .,2
woman sits and reads in the stoop of a wooden door .,5
young boy smiling while hanging from outdoor play equipment .,0
furry dog is running through a doorway leading to plants .,5
shop for fresh produce at an outdoor market in the city .,5
people shop at an outdoor farmer 's market on a cloudy day .,5
woman wearing glasses and a hat pokes her head through the door of a tent on a snowy day .,5
large black dog relaxes while a small brown dog investigates nearby a doorway .,2
dogs tussling on a dog bed , with a french door and a Persian rug in the background .,5
woman at an outdoor food stand .,5
woman makes a purchase at an outdoor vendor .,5
man has his arm on the woman as they shop in an outdoor market .,0
man is standing in front of glass doors with a blue spot and a pink spot .,0
man is standing outside the glass doors of an art center .,0
man walking through glass double doors .,0
standing at glass doors with big blue circle and big pink circle,0
tan and white dogs look at each other in an outdoor setting .,6
man and woman stand near a large red sculpture outdoors .,5
strolling through an indoor market .,5
dog is being squirted with water in the face outdoors .,5
brown dog indoors , with a large pink toy .,0
couple kiss outdoors , while another couple watch .,6
girl is diving into an indoor pool .,0
people are in an indoor swimming pool and one girl is in the act of jumping in headfirst .,2
teenagers are swimming in an indoor pool together .,5
couple is photographed in front of a large outdoor fountain .,5
girl stands nearby while a boy sits in an open doorway .,5
little girl leans on a concrete wall next to a blue door where a shirtless child sits .,5
man outdoors near equipment .,5
small black child plays on an outdoor jungle gym .,5
blow bubbles outdoors .,0
child in a white bathrobe is standing in a doorway .,0
young black child is wrapped in a white robe and standing in a bathroom doorway .,2
young girl wearing a white bathrobe stands by a door .,5
woman looking at jewlery at a booth at an outdoor fair .,6
group of children are playing with bubbles outdoors .,5
zaftig woman in a tube top and jeans dancing outdoors , with a guitarist behind her .,5
flips her hair as she dances outdoors , band in background .,2
big tan dog drinks water from an outdoor water spout .,2
man wearing white walks passed a shuttered building with an advertising banner over the door .,5
little boy stands in the doorway of a van .,6
group of people sit on an outdoor patio with lots of potted plants .,2
young asian girl is sliding down a pole on outdoor playground equipment .,2
women in black embrace at crowded outdoor event .,2
children are playing on a trampoline outdoors .,5
girls jump on an outdoor trampoline .,5
girls sit by a doorway on the steps .,5
women in period dress sitting in a doorway .,5
women with white head garb and long dresses sitting in front of a door on steps reading and drinking a beverage .,0
children are playing in an outdoor swimming pool .,5
with outdoor gear taking a picture .,5
man on a bike is seen among a crowd of people at an outdoor event .,5
small dog runs after a red ball , though a leafy outdoor area .,0
near 5 orange outdoor toilets in a city,5
girl in red dress plays on outdoor tire swing .,2
dog catches a tennis ball in its mouth indoors .,5
man stands outside of a doorway on his cellphone .,5
man wearing a white shirt is standing in a doorway surrounded by green bars , and his holding a cellphone up to his right ear .,0
is talking on mobile , standing in a doorway .,5
child with shoulder-length brown hair is playing in water outdoors .,5
young boy wearing a military sun hat catches a Frisbee outdoors .,5
person with blue hair , a baseball cap , and a hood on stands outdoors in a crowd .,5
man sits outdoors with some of his belongings .,0
women perform outdoors .,5
baby is trying to eat a large red plastic toy outdoors .,0
people ride in an outdoor elevator .,2
person eats takeout while watching a small television .,2
person sits on the floor and eats in front of a television .,5
television with a picture of a girl on it .,5
young man sits on the floor by the television with a fast food meal in front of him .,5
little kid holds up a remote control in front of the television .,2
dog in a living room laying on a stuffed animal with a television in the background .,0
man is operating a television camera high up in a crowded stadium .,2
women on a street are stopped at a television .,0
men and women drink wine while watching television .,0
